{
  "$schema": "./schemas/dag.schema.json",
  "schemaVersion": 2,
  "kind": "jrpg-template-extrapolation-dag",
  "id": "holleman-jrpg-plan-v2",
  "title": "JRPG project-plan extrapolation DAG",
  "source": {
    "path": "../JRPG Project Plan Template.md",
    "author": "Patrick Holleman",
    "use": "Template headings and production dependencies are transformed into verifiable deliverable contracts; the source text remains authoritative."
  },
  "nodes": [
    {
      "id": "source.template",
      "label": "Project-plan template",
      "kind": "source",
      "templateAnchor": "JRPG PROJECT PLAN TEMPLATE",
      "dependsOn": [],
      "required": true,
      "contract": { "minimumArtifacts": 1, "minimumWords": 3000 },
      "extrapolation": { "objective": "Retain the original template as the root authority.", "output": "JRPG Project Plan Template.md", "sections": [] }
    },
    {
      "id": "design.vision",
      "label": "Vision document",
      "kind": "document",
      "templateAnchor": "Vision Doc",
      "dependsOn": ["source.template"],
      "required": true,
      "contract": {
        "minimumArtifacts": 1,
        "minimumWords": 900,
        "requiredTermGroups": [["genre"], ["hook"], ["tone"], ["battle"], ["character"], ["location"], ["plot"]]
      },
      "extrapolation": {
        "objective": "Define the stable 80% vision that constrains every downstream decision.",
        "output": "docs/01-vision-doc.md",
        "sections": ["Genre, hook, and tone", "Battle-system basics", "Characters", "Locations", "Highest-level plot beats", "Scope and exclusions"]
      }
    },
    {
      "id": "design.technical-gdd",
      "label": "Technical GDD",
      "kind": "document",
      "templateAnchor": "Technical GDD",
      "dependsOn": ["design.vision"],
      "required": true,
      "contract": {
        "minimumArtifacts": 1,
        "minimumWords": 1200,
        "requiredTermGroups": [["combat", "battle"], ["exploration", "field"], ["save", "persistence"], ["data"], ["ui", "interface"]]
      },
      "extrapolation": {
        "objective": "Specify mechanics and data contracts precisely enough for implementation.",
        "output": "docs/02-technical-gdd.md",
        "sections": ["Runtime loop", "Combat rules", "Field interaction", "Progression", "Data and saves", "Failure behavior", "Accessibility"]
      }
    },
    {
      "id": "narrative.beats",
      "label": "Beats outline",
      "kind": "document",
      "templateAnchor": "Beats Outline",
      "dependsOn": ["design.vision"],
      "required": true,
      "contract": {
        "minimumArtifacts": 1,
        "minimumWords": 700,
        "requiredTermGroups": [["chapter"], ["quest", "objective"], ["boss", "encounter"], ["location", "map"]]
      },
      "extrapolation": {
        "objective": "Give every chapter a quest, route, cast movement, and boss outcome.",
        "output": "docs/03-beats-outline.md",
        "sections": ["Chapter quest", "Locations", "Characters", "Boss", "Exit state"]
      }
    },
    {
      "id": "narrative.detailed-outline",
      "label": "Detailed outline",
      "kind": "document",
      "templateAnchor": "Detailed Outline",
      "dependsOn": ["narrative.beats"],
      "required": true,
      "contract": { "minimumArtifacts": 1, "minimumWords": 1200, "requiredTermGroups": [["scene"], ["theme", "thematic", "narrative target"], ["chapter"]] },
      "extrapolation": {
        "objective": "Order roughly 80% of scenes and expose their thematic and production consequences.",
        "output": "docs/04-detailed-outline.md",
        "sections": ["Ordered scenes", "Scene objective", "Location", "Participants", "Theme", "Required assets", "Transition"]
      }
    },
    {
      "id": "production.asset-list",
      "label": "Master asset list",
      "kind": "document",
      "templateAnchor": "Asset List",
      "dependsOn": ["design.vision", "narrative.detailed-outline"],
      "required": true,
      "contract": { "minimumArtifacts": 1, "minimumWords": 700, "requiredTermGroups": [["environment", "location"], ["character"], ["ui"], ["animation"], ["reference"]] },
      "extrapolation": {
        "objective": "Derive an authoritative, reference-backed production inventory from the outline.",
        "output": "docs/06-master-asset-list.md",
        "sections": ["Asset ID", "Owner", "Source scene/system", "Reference", "Dimensions or budget", "Status", "Acceptance gate"]
      }
    },
    {
      "id": "presentation.battle-shot",
      "label": "One true battle shot",
      "kind": "artifact",
      "templateAnchor": "Battle Shot",
      "dependsOn": ["design.vision", "design.technical-gdd", "production.asset-list"],
      "required": true,
      "contract": { "minimumArtifacts": 2, "requiredKinds": ["image", "markdown"] },
      "extrapolation": {
        "objective": "Show genre, turn/action structure, party composition, threat, and the combat hook in one authored frame.",
        "output": "assets/production/jrpg-one-true-battle-shot.png",
        "sections": ["Composition brief", "Hook read", "Party and threat read", "UI read", "Art provenance"]
      }
    },
    {
      "id": "presentation.world-shot",
      "label": "One true world/story shot",
      "kind": "artifact",
      "templateAnchor": "World/Story Shot",
      "dependsOn": ["design.vision", "narrative.detailed-outline", "production.asset-list"],
      "required": true,
      "contract": { "minimumArtifacts": 2, "requiredKinds": ["image", "markdown"] },
      "extrapolation": {
        "objective": "Make genre and tone legible in a single world/story composition.",
        "output": "assets/production/jrpg-one-true-world-shot.png",
        "sections": ["Location", "Dramatic beat", "Tone cues", "Character blocking", "Art provenance"]
      }
    },
    {
      "id": "presentation.menu-shot",
      "label": "One true menu shot",
      "kind": "artifact",
      "templateAnchor": "Menu Shot",
      "dependsOn": ["design.vision", "design.technical-gdd", "production.asset-list"],
      "required": true,
      "contract": { "minimumArtifacts": 2, "requiredKinds": ["source", "markdown"] },
      "extrapolation": {
        "objective": "Show the intended customization density, party identity, and decision hierarchy.",
        "output": "assets/production/jrpg-one-true-menu-shot.png",
        "sections": ["Primary decision", "Party read", "Customization depth", "Information hierarchy", "Accessibility"]
      }
    },
    {
      "id": "presentation.video-teaser",
      "label": "Internal video teaser",
      "kind": "artifact",
      "templateAnchor": "Video Teaser",
      "dependsOn": ["presentation.battle-shot", "presentation.world-shot", "presentation.menu-shot"],
      "required": false,
      "contract": { "minimumArtifacts": 1 },
      "extrapolation": {
        "objective": "Animate the battle and world vision for animation, VFX, and battle-scripting alignment.",
        "output": "assets/production/jrpg-internal-teaser.mp4",
        "sections": ["Shot list", "Timing", "Combat beat", "World beat", "Audio intent"]
      }
    },
    {
      "id": "production.staffing",
      "label": "Staffing and contractor plan",
      "kind": "document",
      "templateAnchor": "Contractors/Staff",
      "dependsOn": ["design.vision", "design.technical-gdd", "production.asset-list"],
      "required": true,
      "contract": { "minimumArtifacts": 1, "minimumWords": 300, "requiredTermGroups": [["artist", "art director", "art"], ["programmer", "engineer", "developer", "technical"], ["writer", "narrative"], ["producer", "production"]] },
      "extrapolation": {
        "objective": "Map JRPG-specific production responsibilities, capability gaps, and decision ownership.",
        "output": "docs/27-staffing-and-contractor-plan.md",
        "sections": ["Roles", "Relevant experience", "Ownership", "Hiring order", "Review gates", "Budget assumptions"]
      }
    },
    {
      "id": "engine.asset-management",
      "label": "Asset-management pipeline",
      "kind": "system",
      "templateAnchor": "Asset Management",
      "dependsOn": ["production.asset-list"],
      "required": true,
      "contract": { "minimumArtifacts": 2, "requiredKinds": ["markdown", "data"] },
      "extrapolation": {
        "objective": "Make asset sources, exports, manifests, validation, and ownership reproducible.",
        "output": "assets/production/README.md",
        "sections": ["Source files", "Build commands", "Manifest", "Runtime copy", "Validation", "Ownership"]
      }
    },
    {
      "id": "engine.field",
      "label": "World and field interaction",
      "kind": "system",
      "templateAnchor": "World and Field Maps/Interaction",
      "dependsOn": ["design.technical-gdd", "engine.asset-management"],
      "required": true,
      "contract": { "minimumArtifacts": 2, "requiredKinds": ["markdown", "source"] },
      "extrapolation": {
        "objective": "Implement and document movement, collision, interaction, cameras, routes, and map-specific mechanics.",
        "output": "docs/09-level-and-encounter-bible.md",
        "sections": ["Coordinate model", "Collision", "Interaction", "Camera", "Routes", "Failure cases"]
      }
    },
    {
      "id": "engine.battle",
      "label": "Battle mechanics",
      "kind": "system",
      "templateAnchor": "Battle Mechanics",
      "dependsOn": ["design.technical-gdd"],
      "required": true,
      "contract": { "minimumArtifacts": 2, "requiredKinds": ["markdown", "source"], "requiredTermGroups": [["damage"], ["turn", "cooldown", "recovery"], ["enemy"], ["victory", "defeat"]] },
      "extrapolation": {
        "objective": "Implement the battle hook and all rules needed by content authors.",
        "output": "docs/02-technical-gdd.md",
        "sections": ["Command model", "Timing", "Damage", "Resources", "Enemy AI", "Objectives", "Victory and defeat"]
      }
    },
    {
      "id": "engine.stats-gear",